[INFO] Scanning for projects...
[INFO] 
[INFO] ---------------------< MrYodaAPINew:MrYodaAPINew >----------------------
[INFO] Building MrYodaAPINew 0.0.1-SNAPSHOT
[INFO]   from pom.xml
[INFO] --------------------------------[ jar ]---------------------------------
[INFO] 
[INFO] --- resources:3.3.1:resources (default-resources) @ MrYodaAPINew ---
[INFO] skip non existing resourceDirectory C:\Users\RANJITH\Pictures\MrYodaAPINew\src\main\resources
[INFO] 
[INFO] --- compiler:3.11.0:compile (default-compile) @ MrYodaAPINew ---
[INFO] Nothing to compile - all classes are up to date
[INFO] 
[INFO] --- resources:3.3.1:testResources (default-testResources) @ MrYodaAPINew ---
[INFO] Copying 1 resource from src\test\resources to target\test-classes
[INFO] 
[INFO] --- compiler:3.11.0:testCompile (default-testCompile) @ MrYodaAPINew ---
[INFO] Nothing to compile - all classes are up to date
[INFO] 
[INFO] --- surefire:3.1.2:test (default-test) @ MrYodaAPINew ---
[INFO] Using auto detected provider org.apache.maven.surefire.testng.TestNGProvider
[INFO] 
[INFO] -------------------------------------------------------
[INFO]  T E S T S
[INFO] -------------------------------------------------------
[INFO] Running TestSuite
...
... TestNG 7.8.0 by CΘdric Beust (cedric@beust.com)
...


????????????????????????????????????????????????????????????
?         NON-MEMBER LOGIN TEST (No Membership)            ?
????????????????????????????????????????????????????????????

==================================================
========== TOKEN GENERATION START (NON_MEMBER) ==========
==================================================
Request method:	POST
Request URI:	https://dev-api-yodadiagnostics.yodaprojects.com/otps/getOtp
Proxy:			<none>
Request params:	<none>
Query params:	<none>
Form params:	<none>
Path params:	<none>
Headers:		Accept=*/*
				Content-Type=application/json
Cookies:		<none>
Multiparts:		<none>
Body:
{
    "country_code": "+91",
    "mobile": "9666666665"
}
Request method:	POST
Request URI:	https://dev-api-yodadiagnostics.yodaprojects.com/otps/getOtp
Proxy:			<none>
Request params:	<none>
Query params:	<none>
Form params:	<none>
Path params:	<none>
Headers:		Accept=*/*
				Content-Type=application/json
Cookies:		<none>
Multiparts:		<none>
Body:
{
    "country_code": "+91",
    "mobile": "9666666665",
    "otp": "123456"
}
Token generated for NON_MEMBER: eyJhbGciOiJIUzI1NiIsInR5cCI6IkpXVCJ9.eyJ1c2VyR3VpZCI6ImRiNjgyYWJiLTMxZDEtNDRkZi1iZjE5LTU1N2IwMDNhNWM2OSIsIm1vYmlsZSI6Ijk2NjY2NjY2NjUiLCJmaXJzdF9uYW1lIjoiUmFuaml0aCIsImxhc3RfbmFtZSI6Imt1bWFyIiwiZW1haWwiOiIiLCJyb2xlIjoidXNlcl9vbmx5IiwiaWF0IjoxNzY2NzU4NDQ3LCJleHAiOjE3ODI1NDQ2ODd9.xHkfm2EAZshOVKioCJ0GosDS2y0nQWQrfrU7zoUqweA
? NON-MEMBER LOGIN SUCCESS
   Token: eyJhbGciOiJIUzI1NiIsInR5cCI6IkpXVCJ9.eyJ1c2VyR3VpZCI6ImRiNjgyYWJiLTMxZDEtNDRkZi1iZjE5LTU1N2IwMDNhNWM2OSIsIm1vYmlsZSI6Ijk2NjY2NjY2NjUiLCJmaXJzdF9uYW1lIjoiUmFuaml0aCIsImxhc3RfbmFtZSI6Imt1bWFyIiwiZW1haWwiOiIiLCJyb2xlIjoidXNlcl9vbmx5IiwiaWF0IjoxNzY2NzU4NDQ3LCJleHAiOjE3ODI1NDQ2ODd9.xHkfm2EAZshOVKioCJ0GosDS2y0nQWQrfrU7zoUqweA
   Mobile: 8220220227 (NOT a paid member)
   Stored in: RequestContext.getNonMemberToken()
   First Name: Ranjith
   Last Name: kumar
   User ID: db682abb-31d1-44df-bf19-557b003a5c69

===== LOCATION API ù NON-MEMBER (8220220227 - NOT a paid member) =====
Request method:	POST
Request URI:	https://dev-api-yodadiagnostics.yodaprojects.com/tests/getlocations
Proxy:			<none>
Request params:	<none>
Query params:	<none>
Form params:	<none>
Path params:	<none>
Headers:		Authorization=eyJhbGciOiJIUzI1NiIsInR5cCI6IkpXVCJ9.eyJ1c2VyR3VpZCI6ImRiNjgyYWJiLTMxZDEtNDRkZi1iZjE5LTU1N2IwMDNhNWM2OSIsIm1vYmlsZSI6Ijk2NjY2NjY2NjUiLCJmaXJzdF9uYW1lIjoiUmFuaml0aCIsImxhc3RfbmFtZSI6Imt1bWFyIiwiZW1haWwiOiIiLCJyb2xlIjoidXNlcl9vbmx5IiwiaWF0IjoxNzY2NzU4NDQ3LCJleHAiOjE3ODI1NDQ2ODd9.xHkfm2EAZshOVKioCJ0GosDS2y0nQWQrfrU7zoUqweA
				Accept=*/*
				Content-Type=application/x-www-form-urlencoded; charset=ISO-8859-1
Cookies:		<none>
Multiparts:		<none>
Body:			<none>

? Total Locations Found: 6
   Location: Ameerpet (HQ) | City: Hyderabad | State: Telangana | Status: ACTIVE | ID: 64870066842708a0d5ae6c77
   ? Coordinates: Lat=17.4358447, Long=78.452737
? Stored: Ameerpet (HQ) ? ID: 64870066842708a0d5ae6c77 | City: Hyderabad | State: Telangana | Coordinates: (17.4358447, 78.452737)
   Location: Guntur | City: Guntur | State: Andhra Pradesh | Status: ACTIVE | ID: 64870066842708a0d5ae6c74
   ? Coordinates: Lat=16.2992859, Long=80.4515523
? Stored: Guntur ? ID: 64870066842708a0d5ae6c74 | City: Guntur | State: Andhra Pradesh | Coordinates: (16.2992859, 80.4515523)
   Location: Khammam | City: Khammam | State: Telangana | Status: ACTIVE | ID: 68ecce703d573db19b650c76
   ? Coordinates: Lat=17.248727, Long=80.1668882
? Stored: Khammam ? ID: 68ecce703d573db19b650c76 | City: Khammam | State: Telangana | Coordinates: (17.248727, 80.1668882)
   Location: Madhapur | City: Hyderabad | State: Telangana | Status: ACTIVE | ID: 676a5fa720093d2807af03a5
   ? Coordinates: Lat=17.4406327, Long=78.3900194
? Stored: Madhapur ? ID: 676a5fa720093d2807af03a5 | City: Hyderabad | State: Telangana | Coordinates: (17.4406327, 78.3900194)
   Location: Tirupati | City: Tirupati | State: Andhra Pradesh | Status: ACTIVE | ID: 64870066842708a0d5ae6c75
   ? Coordinates: Lat=13.6350832, Long=79.42642049999999
? Stored: Tirupati ? ID: 64870066842708a0d5ae6c75 | City: Tirupati | State: Andhra Pradesh | Coordinates: (13.6350832, 79.42642049999999)
   Location: Visakhapatnam | City: Visakhapatnam | State: Andhra Pradesh | Status: ACTIVE | ID: 67346a7655a51ec8ef586bb1
   ? Coordinates: Lat=17.7087874, Long=83.3106882
? Stored: Visakhapatnam ? ID: 67346a7655a51ec8ef586bb1 | City: Visakhapatnam | State: Andhra Pradesh | Coordinates: (17.7087874, 83.3106882)

? Critical Location 'Madhapur' found and stored: 676a5fa720093d2807af03a5
   ? Madhapur Coordinates: Lat=17.4406327, Long=78.3900194
   This location will be used in GlobalSearch and AddToCart APIs

? Locations stored for reuse in next APIs

Running Global Search as part of NON-MEMBER flow...

????????????????????????????????????????????????????????????
?        GLOBAL SEARCH API TEST - COMPLETE FLOW           ?
????????????????????????????????????????????????????????????

? FETCHING BRANDS...
Request method:	GET
Request URI:	https://dev-api-yodamembership.yodaprojects.com/brand/getAllBrands
Proxy:			<none>
Request params:	<none>
Query params:	<none>
Form params:	<none>
Path params:	<none>
Headers:		Accept=*/*
Cookies:		<none>
Multiparts:		<none>
Body:			<none>
   ?? Failed to fetch brands: 404
   ?? Using HARDCODED Brand ID for 'Diagnostics'
? DEBUG ? STORED LOCATIONS: {Tirupati=64870066842708a0d5ae6c75, Visakhapatnam=67346a7655a51ec8ef586bb1, Khammam=68ecce703d573db19b650c76, Madhapur=676a5fa720093d2807af03a5, Ameerpet (HQ)=64870066842708a0d5ae6c77, Guntur=64870066842708a0d5ae6c74}

? STEP 1: Validating Location from Previous API (LocationAPI)
   ? Location 'Madhapur' validated from LocationAPI: 676a5fa720093d2807af03a5
   ? Confirmed: Using correct Madhapur location ID (676a5fa720093d2807af03a5)
   ? This location will be used for Global Search

??  IMPORTANT: We are NOT searching for CBC!
   If CBC appears in results, it's a bug in the search logic.

? Tests to Search: Blood Coagulation, Bone Profile -1
? Total Tests: 2

? SEARCHING FOR 2 TESTS
? LOCATION: Madhapur ? 676a5fa720093d2807af03a5

--- AddToCart For Non-Member ---

? CUSTOM PAYLOAD BUILDER for db682abb-31d1-44df-bf19-557b003a5c69
   ??  No tests found in RequestContext (must run GlobalSearch first)

????????????????????????????????????????????????????????????
?     GET CART BY ID API ù EXISTING MEMBER                 ?
????????????????????????????????????????????????????????????

? GET CART BY ID REQUEST:
   User ID: db682abb-31d1-44df-bf19-557b003a5c69
   Order Type: home
   Location: Madhapur (676a5fa720093d2807af03a5)
Request method:	GET
Request URI:	https://dev-api-yodadiagnostics.yodaprojects.com/carts/v2/getCartById/db682abb-31d1-44df-bf19-557b003a5c69?location=676a5fa720093d2807af03a5&order_type=home
Proxy:			<none>
Request params:	<none>
Query params:	location=676a5fa720093d2807af03a5
				order_type=home
Form params:	<none>
Path params:	<none>
Headers:		Authorization=eyJhbGciOiJIUzI1NiIsInR5cCI6IkpXVCJ9.eyJ1c2VyR3VpZCI6ImRiNjgyYWJiLTMxZDEtNDRkZi1iZjE5LTU1N2IwMDNhNWM2OSIsIm1vYmlsZSI6Ijk2NjY2NjY2NjUiLCJmaXJzdF9uYW1lIjoiUmFuaml0aCIsImxhc3RfbmFtZSI6Imt1bWFyIiwiZW1haWwiOiIiLCJyb2xlIjoidXNlcl9vbmx5IiwiaWF0IjoxNzY2NzU4NDQ3LCJleHAiOjE3ODI1NDQ2ODd9.xHkfm2EAZshOVKioCJ0GosDS2y0nQWQrfrU7zoUqweA
				Accept=*/*
Cookies:		<none>
Multiparts:		<none>
Body:			<none>

??????????????????????????????????????????????????????????????
?     COMPREHENSIVE GET CART VALIDATION - NON_MEMBER
??????????????????????????????????????????????????????????????

? ====== COMPLETE API RESPONSE (Pretty Print) ======
{
    "status": 200,
    "success": true,
    "msg": "Cart details fetched successfully",
    "total_amount": 0,
    "data": null
}
{
    "status": 200,
    "success": true,
    "msg": "Cart details fetched successfully",
    "total_amount": 0,
    "data": null
}
=====================================================


? STEP 1: Validating API Response
   ? Success flag: true
   ? Response message: Cart details fetched successfully

? STEP 2: Validating Cart Basic Fields
   ??  WARNING: Cart data is NULL (empty cart)
   ??  This may happen when order_type filter excludes all items
   ??  Skipping validation - cart is empty or filtered out

????????????????????????????????????????????????????????????
?     ADD ADDRESS API ù EXISTING MEMBER                    ?
????????????????????????????????????????????????????????????

? Using Location: Madhapur
? User: Ranjith kumar
? Mobile: 8220220227

? ADD ADDRESS REQUEST:
User ID: db682abb-31d1-44df-bf19-557b003a5c69
Receiver Name: Ranjith kumar
Mobile: 8220220227
Address Line 1: Hyderabad
Name (Road/Area): Madhapur
Type: home
Country Code: +91
City: Hyderabad
State: Telangana
Country: India
Postal Code: 500033
Coordinates: Lat=17.4406327, Long=78.3900194
Request method:	POST
Request URI:	https://dev-api-yodadiagnostics.yodaprojects.com/address/addAddress
Proxy:			<none>
Request params:	<none>
Query params:	<none>
Form params:	<none>
Path params:	<none>
Headers:		Authorization=eyJhbGciOiJIUzI1NiIsInR5cCI6IkpXVCJ9.eyJ1c2VyR3VpZCI6ImRiNjgyYWJiLTMxZDEtNDRkZi1iZjE5LTU1N2IwMDNhNWM2OSIsIm1vYmlsZSI6Ijk2NjY2NjY2NjUiLCJmaXJzdF9uYW1lIjoiUmFuaml0aCIsImxhc3RfbmFtZSI6Imt1bWFyIiwiZW1haWwiOiIiLCJyb2xlIjoidXNlcl9vbmx5IiwiaWF0IjoxNzY2NzU4NDQ3LCJleHAiOjE3ODI1NDQ2ODd9.xHkfm2EAZshOVKioCJ0GosDS2y0nQWQrfrU7zoUqweA
				Accept=*/*
				Content-Type=application/json
Cookies:		<none>
Multiparts:		<none>
Body:
{
    "country": "India",
    "city": "Hyderabad",
    "recipient_mobile_number": "8220220227",
    "latitude": "17.4406327",
    "type": "home",
    "country_code": "+91",
    "user_id": "db682abb-31d1-44df-bf19-557b003a5c69",
    "address_line1": "Hyderabad",
    "name": "Madhapur",
    "receiver_name": "Ranjith kumar",
    "state": "Telangana",
    "postal_code": "500033",
    "longitude": "78.3900194"
}
??  Address already exists (HTTP 409) - Skipping validation

????????????????????????????????????????????????????????????
?     GET ADDRESS BY USER ID API ù EXISTING MEMBER         ?
????????????????????????????????????????????????????????????

? GET ADDRESS BY USER ID REQUEST:
   User ID: db682abb-31d1-44df-bf19-557b003a5c69
Request method:	GET
Request URI:	https://dev-api-yodadiagnostics.yodaprojects.com/address/getAddressByUserId/db682abb-31d1-44df-bf19-557b003a5c69
Proxy:			<none>
Request params:	<none>
Query params:	<none>
Form params:	<none>
Path params:	<none>
Headers:		Authorization=eyJhbGciOiJIUzI1NiIsInR5cCI6IkpXVCJ9.eyJ1c2VyR3VpZCI6ImRiNjgyYWJiLTMxZDEtNDRkZi1iZjE5LTU1N2IwMDNhNWM2OSIsIm1vYmlsZSI6Ijk2NjY2NjY2NjUiLCJmaXJzdF9uYW1lIjoiUmFuaml0aCIsImxhc3RfbmFtZSI6Imt1bWFyIiwiZW1haWwiOiIiLCJyb2xlIjoidXNlcl9vbmx5IiwiaWF0IjoxNzY2NzU4NDQ3LCJleHAiOjE3ODI1NDQ2ODd9.xHkfm2EAZshOVKioCJ0GosDS2y0nQWQrfrU7zoUqweA
				Accept=*/*
Cookies:		<none>
Multiparts:		<none>
Body:			<none>
   ? HTTP Status: 200

??????????????????????????????????????????????????????????????
?     COMPREHENSIVE GET ADDRESS VALIDATION - NON_MEMBER
??????????????????????????????????????????????????????????????

? STEP 1: Validating API Response
   ? Success flag: true
   ? Response message: null

? STEP 2: Extracting Addresses
   ? Total addresses found: 2

? STEP 3: Extracting and Storing Address ID (guid)
   ? Address GUID extracted: 99cfd160-72e2-4fcf-b2f4-56e5bbb49fea
   ? Stored in RequestContext as NON_MEMBER address_id

? STEP 4: Validating Address Details

   ????? Address 1 ?????
   ? GUID: 99cfd160-72e2-4fcf-b2f4-56e5bbb49fea
   ? User ID: db682abb-31d1-44df-bf19-557b003a5c69
   ? Receiver Name: Ranjith kumar
   ? Mobile: 8220220227
   ? Address Line 1: Hyderabad
   ? Name (Area): Madhapur
   ? City: Hyderabad
   ? State: Telangana
   ? Postal Code: 500033
   ? Type: home
   ? Coordinates: Lat=17.4406327, Long=78.3900194

   ????? Address 2 ?????
   ? GUID: cf11587a-95c1-4c3d-a670-f21712b94fcc
   ? User ID: db682abb-31d1-44df-bf19-557b003a5c69
   ? Receiver Name: Ranjith kumar
   ? Mobile: 8220220227
   ? Address Line 1: Guntur
   ? Name (Area): Office
   ? City: Guntur
   ? State: Andhra Pradesh
   ? Postal Code: 522001
   ? Type: office
   ? Coordinates: Lat=16.2992859, Long=80.4515523

? ========================================
   ADDRESS VALIDATION SUMMARY
   ========================================
   Total addresses: 2
   Address ID (guid) stored: 99cfd160-72e2-4fcf-b2f4-56e5bbb49fea
   User Type: NON_MEMBER
   ? ALL ADDRESSES VALIDATED SUCCESSFULLY
   ========================================


========================================
ALL GET ADDRESS VALIDATIONS PASSED FOR NON_MEMBER
========================================
Address ID (guid): 99cfd160-72e2-4fcf-b2f4-56e5bbb49fea
Total Addresses: 2
========================================


????????????????????????????????????????????????????????????
?     GET CENTERS BY ADD API ù EXISTING MEMBER             ?
????????????????????????????????????????????????????????????

? Using Address ID from GetAddressByUserId API: 99cfd160-72e2-4fcf-b2f4-56e5bbb49fea
? Using Lab ID (Location ID) from Location API: 676a5fa720093d2807af03a5

? GET CENTERS BY ADD REQUEST:
   Address ID: 99cfd160-72e2-4fcf-b2f4-56e5bbb49fea
   Lab ID: 676a5fa720093d2807af03a5
Request method:	POST
Request URI:	https://dev-api-yodadiagnostics.yodaprojects.com/slot/getCentersByadd
Proxy:			<none>
Request params:	<none>
Query params:	<none>
Form params:	<none>
Path params:	<none>
Headers:		Authorization=eyJhbGciOiJIUzI1NiIsInR5cCI6IkpXVCJ9.eyJ1c2VyR3VpZCI6ImRiNjgyYWJiLTMxZDEtNDRkZi1iZjE5LTU1N2IwMDNhNWM2OSIsIm1vYmlsZSI6Ijk2NjY2NjY2NjUiLCJmaXJzdF9uYW1lIjoiUmFuaml0aCIsImxhc3RfbmFtZSI6Imt1bWFyIiwiZW1haWwiOiIiLCJyb2xlIjoidXNlcl9vbmx5IiwiaWF0IjoxNzY2NzU4NDQ3LCJleHAiOjE3ODI1NDQ2ODd9.xHkfm2EAZshOVKioCJ0GosDS2y0nQWQrfrU7zoUqweA
				Accept=*/*
				Content-Type=application/json
Cookies:		<none>
Multiparts:		<none>
Body:
{
    "lab_id": "676a5fa720093d2807af03a5",
    "addressid": "99cfd160-72e2-4fcf-b2f4-56e5bbb49fea"
}
   ? HTTP Status: 200

??????????????????????????????????????????????????????????????
?     COMPREHENSIVE GET CENTERS VALIDATION - NON_MEMBER
??????????????????????????????????????????????????????????????

? STEP 1: Validating API Response
   ? Success flag: true
   ? Message: Valid Location
   ? Location validated successfully!

? STEP 2: Validating Center Details
   ??  No center details in response (validation only)

? STEP 3: Cross-validating with Request Payload
   ? Sent Address ID: 99cfd160-72e2-4fcf-b2f4-56e5bbb49fea
   ? Sent Lab ID: 676a5fa720093d2807af03a5
   ? Payload validated against response

? ========================================
   CENTERS BY ADDRESS VALIDATION SUMMARY
   ========================================
   Message: Valid Location
   Address ID: 99cfd160-72e2-4fcf-b2f4-56e5bbb49fea
   Lab ID: 676a5fa720093d2807af03a5
   ? ALL VALIDATIONS PASSED
   ========================================


========================================
ALL GET CENTERS VALIDATIONS PASSED FOR NON_MEMBER
========================================
Message: Valid Location
Address ID: 99cfd160-72e2-4fcf-b2f4-56e5bbb49fea
Lab ID: 676a5fa720093d2807af03a5
========================================


? SEARCHING FOR AVAILABLE SLOTS FOR NON_MEMBER
Request method:	POST
Request URI:	https://dev-api-yodadiagnostics.yodaprojects.com/slot/getSlotCountByTime
Proxy:			<none>
Request params:	<none>
Query params:	<none>
Form params:	<none>
Path params:	<none>
Headers:		Authorization=eyJhbGciOiJIUzI1NiIsInR5cCI6IkpXVCJ9.eyJ1c2VyR3VpZCI6ImRiNjgyYWJiLTMxZDEtNDRkZi1iZjE5LTU1N2IwMDNhNWM2OSIsIm1vYmlsZSI6Ijk2NjY2NjY2NjUiLCJmaXJzdF9uYW1lIjoiUmFuaml0aCIsImxhc3RfbmFtZSI6Imt1bWFyIiwiZW1haWwiOiIiLCJyb2xlIjoidXNlcl9vbmx5IiwiaWF0IjoxNzY2NzU4NDQ3LCJleHAiOjE3ODI1NDQ2ODd9.xHkfm2EAZshOVKioCJ0GosDS2y0nQWQrfrU7zoUqweA
				Accept=*/*
				Content-Type=application/json
Cookies:		<none>
Multiparts:		<none>
Body:
{
    "slot_start_time": "2025-12-26",
    "limit": 100,
    "page": 1,
    "type": "home",
    "addressguid": "99cfd160-72e2-4fcf-b2f4-56e5bbb49fea"
}
   ? Found Slot: 2025-12-26 2025-12-26 21:00:00 - 2025-12-26 22:00:00

? UPDATING CART WITH SLOT FOR NON_MEMBER
??  No home collection tests to add to cart!
Request method:	POST
Request URI:	https://dev-api-yodadiagnostics.yodaprojects.com/carts/v2/addCart
Proxy:			<none>
Request params:	<none>
Query params:	<none>
Form params:	<none>
Path params:	<none>
Headers:		Authorization=eyJhbGciOiJIUzI1NiIsInR5cCI6IkpXVCJ9.eyJ1c2VyR3VpZCI6ImRiNjgyYWJiLTMxZDEtNDRkZi1iZjE5LTU1N2IwMDNhNWM2OSIsIm1vYmlsZSI6Ijk2NjY2NjY2NjUiLCJmaXJzdF9uYW1lIjoiUmFuaml0aCIsImxhc3RfbmFtZSI6Imt1bWFyIiwiZW1haWwiOiIiLCJyb2xlIjoidXNlcl9vbmx5IiwiaWF0IjoxNzY2NzU4NDQ3LCJleHAiOjE3ODI1NDQ2ODd9.xHkfm2EAZshOVKioCJ0GosDS2y0nQWQrfrU7zoUqweA
				Accept=*/*
				Content-Type=application/json
Cookies:		<none>
Multiparts:		<none>
Body:
{
    "user_id": "db682abb-31d1-44df-bf19-557b003a5c69",
    "slot_guid": "af74d846-8ac2-4205-ae5d-a79f68855054",
    "lab_location_id": "676a5fa720093d2807af03a5",
    "product_details": [
        
    ]
}
   ? Cart Updated with Slot. Cart GUID: bb89d801-01f3-4a57-9df0-a1be84bb12cd

????????????????????????????????????????????????????????????
?     CREATE ORDER API ù EXISTING MEMBER                   ?
????????????????????????????????????????????????????????????
[ERROR] Tests run: 10, Failures: 2, Errors: 0, Skipped: 0, Time elapsed: 10.90 s <<< FAILURE! -- in TestSuite
[ERROR] com.mryoda.diagnostics.api.tests.GlobalSearchAPITest.testGlobalSearch_ForNonMember -- Time elapsed: 0.508 s <<< FAILURE!
java.lang.RuntimeException: ? Token is null! Please login first.
	at com.mryoda.diagnostics.api.utils.GlobalSearchHelper.searchTestsByFullNames(GlobalSearchHelper.java:264)
	at com.mryoda.diagnostics.api.tests.GlobalSearchAPITest.performGlobalSearch(GlobalSearchAPITest.java:102)
	at com.mryoda.diagnostics.api.tests.GlobalSearchAPITest.testGlobalSearch_ForNonMember(GlobalSearchAPITest.java:215)
	at java.base/jdk.internal.reflect.NativeMethodAccessorImpl.invoke0(Native Method)
	at java.base/jdk.internal.reflect.NativeMethodAccessorImpl.invoke(NativeMethodAccessorImpl.java:77)
	at java.base/jdk.internal.reflect.DelegatingMethodAccessorImpl.invoke(DelegatingMethodAccessorImpl.java:43)
	at java.base/java.lang.reflect.Method.invoke(Method.java:568)
	at org.testng.internal.invokers.MethodInvocationHelper.invokeMethod(MethodInvocationHelper.java:139)
	at org.testng.internal.invokers.TestInvoker.invokeMethod(TestInvoker.java:664)
	at org.testng.internal.invokers.TestInvoker.invokeTestMethod(TestInvoker.java:227)
	at org.testng.internal.invokers.MethodRunner.runInSequence(MethodRunner.java:50)
	at org.testng.internal.invokers.TestInvoker$MethodInvocationAgent.invoke(TestInvoker.java:957)
	at org.testng.internal.invokers.TestInvoker.invokeTestMethods(TestInvoker.java:200)
	at org.testng.internal.invokers.TestMethodWorker.invokeTestMethods(TestMethodWorker.java:148)
	at org.testng.internal.invokers.TestMethodWorker.run(TestMethodWorker.java:128)
	at java.base/java.util.ArrayList.forEach(ArrayList.java:1511)
	at org.testng.TestRunner.privateRun(TestRunner.java:848)
	at org.testng.TestRunner.run(TestRunner.java:621)
	at org.testng.SuiteRunner.runTest(SuiteRunner.java:443)
	at org.testng.SuiteRunner.runSequentially(SuiteRunner.java:437)
	at org.testng.SuiteRunner.privateRun(SuiteRunner.java:397)
	at org.testng.SuiteRunner.run(SuiteRunner.java:336)
	at org.testng.SuiteRunnerWorker.runSuite(SuiteRunnerWorker.java:52)
	at org.testng.SuiteRunnerWorker.run(SuiteRunnerWorker.java:95)
	at org.testng.TestNG.runSuitesSequentially(TestNG.java:1280)
	at org.testng.TestNG.runSuitesLocally(TestNG.java:1200)
	at org.testng.TestNG.runSuites(TestNG.java:1114)
	at org.testng.TestNG.run(TestNG.java:1082)
	at org.apache.maven.surefire.testng.TestNGExecutor.run(TestNGExecutor.java:308)
	at org.apache.maven.surefire.testng.TestNGXmlTestSuite.execute(TestNGXmlTestSuite.java:71)
	at org.apache.maven.surefire.testng.TestNGProvider.invoke(TestNGProvider.java:113)
	at org.apache.maven.surefire.booter.ForkedBooter.runSuitesInProcess(ForkedBooter.java:385)
	at org.apache.maven.surefire.booter.ForkedBooter.execute(ForkedBooter.java:162)
	at org.apache.maven.surefire.booter.ForkedBooter.run(ForkedBooter.java:507)
	at org.apache.maven.surefire.booter.ForkedBooter.main(ForkedBooter.java:495)

[ERROR] com.mryoda.diagnostics.api.tests.CreateOrderAPITest.testCreateOrder_ForNonMember -- Time elapsed: 0.009 s <<< FAILURE!
java.lang.NullPointerException: Cannot invoke "java.lang.Integer.intValue()" because the return value of "com.mryoda.diagnostics.api.utils.RequestContext.getNonMemberTotalAmount()" is null
	at com.mryoda.diagnostics.api.tests.CreateOrderAPITest.testCreateOrder_ForNonMember(CreateOrderAPITest.java:152)
	at java.base/jdk.internal.reflect.NativeMethodAccessorImpl.invoke0(Native Method)
	at java.base/jdk.internal.reflect.NativeMethodAccessorImpl.invoke(NativeMethodAccessorImpl.java:77)
	at java.base/jdk.internal.reflect.DelegatingMethodAccessorImpl.invoke(DelegatingMethodAccessorImpl.java:43)
	at java.base/java.lang.reflect.Method.invoke(Method.java:568)
	at org.testng.internal.invokers.MethodInvocationHelper.invokeMethod(MethodInvocationHelper.java:139)
	at org.testng.internal.invokers.TestInvoker.invokeMethod(TestInvoker.java:664)
	at org.testng.internal.invokers.TestInvoker.invokeTestMethod(TestInvoker.java:227)
	at org.testng.internal.invokers.MethodRunner.runInSequence(MethodRunner.java:50)
	at org.testng.internal.invokers.TestInvoker$MethodInvocationAgent.invoke(TestInvoker.java:957)
	at org.testng.internal.invokers.TestInvoker.invokeTestMethods(TestInvoker.java:200)
	at org.testng.internal.invokers.TestMethodWorker.invokeTestMethods(TestMethodWorker.java:148)
	at org.testng.internal.invokers.TestMethodWorker.run(TestMethodWorker.java:128)
	at java.base/java.util.ArrayList.forEach(ArrayList.java:1511)
	at org.testng.TestRunner.privateRun(TestRunner.java:848)
	at org.testng.TestRunner.run(TestRunner.java:621)
	at org.testng.SuiteRunner.runTest(SuiteRunner.java:443)
	at org.testng.SuiteRunner.runSequentially(SuiteRunner.java:437)
	at org.testng.SuiteRunner.privateRun(SuiteRunner.java:397)
	at org.testng.SuiteRunner.run(SuiteRunner.java:336)
	at org.testng.SuiteRunnerWorker.runSuite(SuiteRunnerWorker.java:52)
	at org.testng.SuiteRunnerWorker.run(SuiteRunnerWorker.java:95)
	at org.testng.TestNG.runSuitesSequentially(TestNG.java:1280)
	at org.testng.TestNG.runSuitesLocally(TestNG.java:1200)
	at org.testng.TestNG.runSuites(TestNG.java:1114)
	at org.testng.TestNG.run(TestNG.java:1082)
	at org.apache.maven.surefire.testng.TestNGExecutor.run(TestNGExecutor.java:308)
	at org.apache.maven.surefire.testng.TestNGXmlTestSuite.execute(TestNGXmlTestSuite.java:71)
	at org.apache.maven.surefire.testng.TestNGProvider.invoke(TestNGProvider.java:113)
	at org.apache.maven.surefire.booter.ForkedBooter.runSuitesInProcess(ForkedBooter.java:385)
	at org.apache.maven.surefire.booter.ForkedBooter.execute(ForkedBooter.java:162)
	at org.apache.maven.surefire.booter.ForkedBooter.run(ForkedBooter.java:507)
	at org.apache.maven.surefire.booter.ForkedBooter.main(ForkedBooter.java:495)

[INFO] 
[INFO] Results:
[INFO] 
[ERROR] Failures: 
[ERROR]   CreateOrderAPITest.testCreateOrder_ForNonMember:152 NullPointer Cannot invoke "java.lang.Integer.intValue()" because the return value of "com.mryoda.diagnostics.api.utils.RequestContext.getNonMemberTotalAmount()" is null
[ERROR]   GlobalSearchAPITest.testGlobalSearch_ForNonMember:215->performGlobalSearch:102 ╗ Runtime ? Token is null! Please login first.
[INFO] 
[ERROR] Tests run: 10, Failures: 2, Errors: 0, Skipped: 0
[INFO] 
[INFO] ------------------------------------------------------------------------
[INFO] BUILD FAILURE
[INFO] ------------------------------------------------------------------------
[INFO] Total time:  14.968 s
[INFO] Finished at: 2025-12-26T19:44:13+05:30
[INFO] ------------------------------------------------------------------------
[ERROR] Failed to execute goal org.apache.maven.plugins:maven-surefire-plugin:3.1.2:test (default-test) on project MrYodaAPINew: There are test failures.
[ERROR] 
[ERROR] Please refer to C:\Users\RANJITH\Pictures\MrYodaAPINew\target\surefire-reports for the individual test results.
[ERROR] Please refer to dump files (if any exist) [date].dump, [date]-jvmRun[N].dump and [date].dumpstream.
[ERROR] -> [Help 1]
[ERROR] 
[ERROR] To see the full stack trace of the errors, re-run Maven with the -e switch.
[ERROR] Re-run Maven using the -X switch to enable full debug logging.
[ERROR] 
[ERROR] For more information about the errors and possible solutions, please read the following articles:
[ERROR] [Help 1] http://cwiki.apache.org/confluence/display/MAVEN/MojoFailureException
